Titel,Url,Art,Gehalt (p.m.)*,Erfahrung,Ort,Datum
Einkauf und Supply Chain,https://www.karriere.at/jobs/5482543,Vollzeit,2019,Berufserfahrung,Österreich,28.3.2019
Regionalverkaufsleiter (m/w),https://www.karriere.at/jobs/5457160,Vollzeit,9175,Projekt-. Bereichsleitung,Rietz. Loosdorf. Weißenbach. Sattledt. Hausmannstätten. Trumau. Stockerau,25.3.2019
Managementpraktikant (m/w),https://www.karriere.at/jobs/5456773,Praktika,2400,Einsteiger,Stockerau. Sattledt. Weißenbach. Loosdorf. Rietz. Hausmannstätten. Trumau,25.3.2019
Leitung Lager und Logistik,https://www.karriere.at/jobs/5482164,Vollzeit,4166,Projekt-. Bereichsleitung,Tiroler Unterland,28.3.2019
Commodity Specialist Indirect (m/f),https://www.karriere.at/jobs/5450543,Vollzeit,3301,Berufserfahrung,Jenbach,25.3.2019
ERP Consultant Logistik (m/w),https://www.karriere.at/jobs/5436384,Vollzeit,5833,Berufserfahrung,Wien. Gleisdorf. Wels. Innsbruck,22.3.2019
Produktmanager für Absauganlagen (m/w),https://www.karriere.at/jobs/5478053,Vollzeit,4875,Berufserfahrung,Hall in Tirol,20.3.2019
Account Manager – Food (m/w),http://www.karriere.at/jobs/5452630,Vollzeit,4166,Berufserfahrung,Österreich,19.3.2019